{
  "blocking_errors": [],
  "generated_at": "2026-05-03T20:25:04Z",
  "metrics": {
    "candidate_metrics": {
      "hist_gradient_boosting": {
        "test_auc": 0.6415344327971061,
        "test_brier_score": 0.2346526207800247,
        "test_log_loss": 0.6619201301788048,
        "validation_auc": 0.639548197813816,
        "validation_brier_score": 0.23509465864335471,
        "validation_log_loss": 0.6628305761470223
      },
      "logistic_regression": {
        "test_auc": 0.6333204710640378,
        "test_brier_score": 0.23586895120274784,
        "test_log_loss": 0.6645177799890788,
        "validation_auc": 0.6304131427210804,
        "validation_brier_score": 0.23638655779662873,
        "validation_log_loss": 0.6655852115637101
      }
    },
    "feature_count": 26,
    "selected_model_type": "hist_gradient_boosting",
    "target_column": "label_point_winner_is_player_a",
    "version": "v1"
  },
  "model_type": "odds",
  "quality_gates": {
    "test_auc_min": 0.55,
    "test_brier_max": 0.3,
    "validation_auc_min": 0.55,
    "validation_brier_max": 0.3
  },
  "schema_version": "model_eval_report_v1",
  "status": "PASSED",
  "warnings": []
}
